{
  "kind": "digest-proof",
  "nonce": "11111111111111111111111111111111",
  "ownerDigest": "sha256:aaaaaaaaaaaaaaaaaaaaaaaaaaaaaaaaaaaaaaaaaaaaaaaaaaaaaaaaaaaaaaaa",
  "hostId": "fixture-host",
  "sourceId": "synthetic",
  "ownerEpoch": "publisher_1",
  "clock": {
    "bootId": "11111111-1111-4111-8111-111111111111",
    "timeNamespace": "time:1"
  },
  "evaluatedAtMs": 1000,
  "receipts": [
    {
      "sourceId": "synthetic",
      "component": "native",
      "health": "current",
      "accepted": 7,
      "originalExpiryMs": 10000,
      "remainingMs": 9000
    }
  ]
}
